{
  "$schema": "http://json-schema.org/draft-07/schema#",
  "title": "thoughtdag-benchmark-gold",
  "type": "object",
  "required": [
    "case_id",
    "gold_answer"
  ],
  "properties": {
    "case_id": {
      "type": "string"
    },
    "gold_answer": {
      "type": "string"
    },
    "accept_also": {
      "type": "array",
      "items": {
        "type": "string"
      }
    },
    "stale_markers": {
      "type": "array",
      "items": {
        "type": "string"
      }
    },
    "distractor_markers": {
      "type": "array",
      "items": {
        "type": "string"
      }
    },
    "per_condition_expectation": {
      "type": "object"
    }
  }
}
